{
  "activity": {
    "annual_income_or_revenue_usd": 655000,
    "annualised_credit_to_income_or_revenue_ratio": 0.6473,
    "annualised_credits_usd": 424000.0,
    "inconsistent": false,
    "period_credits_usd": 106000,
    "period_months": 3
  },
  "case_id": "CASE-700016",
  "coverage": {
    "documents_total": 10,
    "pages_total": 51,
    "pages_unreadable": 0
  },
  "decision_authority": "HUMAN",
  "evidence_anchors": [
    {
      "char_span": [
        29,
        75
      ],
      "doc_id": "DOC-700016-001",
      "key": "legal_name",
      "page": 1,
      "quote": "Company name: Galen Mockley Trading 700016 Ltd",
      "value": "Galen Mockley Trading 700016 Ltd"
    },
    {
      "char_span": [
        76,
        102
      ],
      "doc_id": "DOC-700016-001",
      "key": "incorporation_number",
      "page": 1,
      "quote": "Company number: TST-700016",
      "value": "TST-700016"
    },
    {
      "char_span": [
        63,
        89
      ],
      "doc_id": "DOC-700016-002",
      "key": "registry_number",
      "page": 1,
      "quote": "Company number: TST-700016",
      "value": "TST-700016"
    },
    {
      "char_span": [
        19,
        44
      ],
      "doc_id": "DOC-700016-003",
      "key": "owner_1_name",
      "page": 1,
      "quote": "Name: Hale Simvale 700016",
      "value": "Hale Simvale 700016"
    },
    {
      "char_span": [
        19,
        44
      ],
      "doc_id": "DOC-700016-004",
      "key": "owner_2_name",
      "page": 1,
      "quote": "Name: Iva Testwell 700016",
      "value": "Iva Testwell 700016"
    },
    {
      "char_span": [
        22,
        70
      ],
      "doc_id": "DOC-700016-005",
      "key": "control_person",
      "page": 1,
      "quote": "Director and control person: Hale Simvale 700016",
      "value": "Hale Simvale 700016"
    },
    {
      "char_span": [
        60,
        102
      ],
      "doc_id": "DOC-700016-006",
      "key": "address",
      "page": 1,
      "quote": "Address: 1 Test Street, Sample City 700016",
      "value": "1 Test Street, Sample City 700016"
    },
    {
      "char_span": [
        50,
        76
      ],
      "doc_id": "DOC-700016-007",
      "key": "primary_share",
      "page": 1,
      "quote": "Hale Simvale 700016 | 100%",
      "value": 100
    },
    {
      "char_span": [
        77,
        97
      ],
      "doc_id": "DOC-700016-008",
      "key": "annual_income_or_revenue",
      "page": 1,
      "quote": "Revenue: USD 655,000",
      "value": 655000
    },
    {
      "char_span": [
        83,
        109
      ],
      "doc_id": "DOC-700016-009",
      "key": "period_credits",
      "page": 1,
      "quote": "Total credits: USD 106,000",
      "value": 106000
    },
    {
      "char_span": [
        59,
        103
      ],
      "doc_id": "DOC-700016-010",
      "key": "source_of_funds",
      "page": 1,
      "quote": "Funds are from documented business receipts.",
      "value": "declared receipts"
    }
  ],
  "gaps": [],
  "ownership": {
    "beneficial_owners": [
      {
        "effective_pct": 100.0,
        "name": "Hale Simvale 700016"
      }
    ],
    "control_person": "Hale Simvale 700016",
    "paths": [
      {
        "basis": "document",
        "effective_pct": 100.0,
        "nodes": [
          "Hale Simvale 700016",
          "Galen Mockley Trading 700016 Ltd"
        ],
        "percentages": [
          100.0
        ],
        "person": "Hale Simvale 700016"
      }
    ],
    "unresolved_pct": 0.0
  },
  "provenance": {
    "generator_seed": 20961038,
    "human_reviewed": false,
    "kind": "SYNTHETIC_ORACLE",
    "release_gate_eligible": false
  },
  "quarantine_doc_ids": [],
  "recommendation": "PROCEED",
  "required_gates": [],
  "required_refusals": [],
  "risk": {
    "band": "LOW",
    "cdd_level": "SDD",
    "factor_inputs": {
      "F-BEH-01": false,
      "F-BEH-02": false,
      "F-BEH-03": false,
      "F-CHAN-01": true,
      "F-CHAN-02": false,
      "F-CUST-01": false,
      "F-CUST-02": false,
      "F-CUST-03": false,
      "F-CUST-04": false,
      "F-CUST-05": false,
      "F-CUST-06": false,
      "F-CUST-07": false,
      "F-CUST-08": false,
      "F-GEO-01": false,
      "F-GEO-02": false,
      "F-GEO-03": false,
      "F-GEO-04": false,
      "F-GEO-05": false,
      "F-PROD-01": false,
      "F-PROD-02": false
    },
    "overrides_applied": [],
    "score": 1.5
  },
  "screening": {
    "expected_query_count": 33,
    "true_pep_subjects": [],
    "true_sanctions_subjects": [],
    "unavailable_lists": [],
    "weak_sanctions_subjects": []
  },
  "search_mock": {
    "namesake_exclusion_urls": [],
    "paywall_gap_urls": [],
    "quarantine_urls": [],
    "refusal_urls": [],
    "relevant_media_urls": [],
    "source_urls": [
      "https://citydesk.example/cases/case-700016/profile"
    ]
  },
  "segment": "corporate_simple",
  "tags": [
    "corporate_simple"
  ],
  "verified_fields": [
    {
      "char_span": [
        29,
        75
      ],
      "doc_id": "DOC-700016-001",
      "key": "legal_name",
      "page": 1,
      "quote": "Company name: Galen Mockley Trading 700016 Ltd",
      "value": "Galen Mockley Trading 700016 Ltd"
    },
    {
      "char_span": [
        76,
        102
      ],
      "doc_id": "DOC-700016-001",
      "key": "incorporation_number",
      "page": 1,
      "quote": "Company number: TST-700016",
      "value": "TST-700016"
    },
    {
      "char_span": [
        63,
        89
      ],
      "doc_id": "DOC-700016-002",
      "key": "registry_number",
      "page": 1,
      "quote": "Company number: TST-700016",
      "value": "TST-700016"
    },
    {
      "char_span": [
        19,
        44
      ],
      "doc_id": "DOC-700016-003",
      "key": "owner_1_name",
      "page": 1,
      "quote": "Name: Hale Simvale 700016",
      "value": "Hale Simvale 700016"
    },
    {
      "char_span": [
        19,
        44
      ],
      "doc_id": "DOC-700016-004",
      "key": "owner_2_name",
      "page": 1,
      "quote": "Name: Iva Testwell 700016",
      "value": "Iva Testwell 700016"
    },
    {
      "char_span": [
        22,
        70
      ],
      "doc_id": "DOC-700016-005",
      "key": "control_person",
      "page": 1,
      "quote": "Director and control person: Hale Simvale 700016",
      "value": "Hale Simvale 700016"
    },
    {
      "char_span": [
        60,
        102
      ],
      "doc_id": "DOC-700016-006",
      "key": "address",
      "page": 1,
      "quote": "Address: 1 Test Street, Sample City 700016",
      "value": "1 Test Street, Sample City 700016"
    },
    {
      "char_span": [
        77,
        97
      ],
      "doc_id": "DOC-700016-008",
      "key": "annual_income_or_revenue",
      "page": 1,
      "quote": "Revenue: USD 655,000",
      "value": 655000
    },
    {
      "char_span": [
        83,
        109
      ],
      "doc_id": "DOC-700016-009",
      "key": "period_credits",
      "page": 1,
      "quote": "Total credits: USD 106,000",
      "value": 106000
    }
  ]
}
