{
  "activity": {
    "annual_income_or_revenue_usd": 1066000,
    "annualised_credit_to_income_or_revenue_ratio": 0.6492,
    "annualised_credits_usd": 692000.0,
    "inconsistent": false,
    "period_credits_usd": 173000,
    "period_months": 3
  },
  "case_id": "CASE-700159",
  "coverage": {
    "documents_total": 6,
    "pages_total": 24,
    "pages_unreadable": 0
  },
  "decision_authority": "HUMAN",
  "evidence_anchors": [
    {
      "char_span": [
        19,
        43
      ],
      "doc_id": "DOC-700159-001",
      "key": "legal_name",
      "page": 1,
      "quote": "Name: Ari Simvale 700159",
      "value": "Ari Simvale 700159"
    },
    {
      "char_span": [
        44,
        69
      ],
      "doc_id": "DOC-700159-001",
      "key": "date_of_birth",
      "page": 1,
      "quote": "Date of birth: 1985-09-14",
      "value": "1985-09-14"
    },
    {
      "char_span": [
        86,
        111
      ],
      "doc_id": "DOC-700159-001",
      "key": "passport_number",
      "page": 1,
      "quote": "Passport number: X700159A",
      "value": "X700159A"
    },
    {
      "char_span": [
        46,
        88
      ],
      "doc_id": "DOC-700159-002",
      "key": "address",
      "page": 1,
      "quote": "Address: 1 Test Street, Sample City 700159",
      "value": "1 Test Street, Sample City 700159"
    },
    {
      "char_span": [
        62,
        90
      ],
      "doc_id": "DOC-700159-003",
      "key": "annual_income_or_revenue",
      "page": 1,
      "quote": "Annual income: USD 1,066,000",
      "value": 1066000
    },
    {
      "char_span": [
        69,
        95
      ],
      "doc_id": "DOC-700159-004",
      "key": "period_credits",
      "page": 1,
      "quote": "Total credits: USD 173,000",
      "value": 173000
    },
    {
      "char_span": [
        45,
        87
      ],
      "doc_id": "DOC-700159-005",
      "key": "source_of_funds",
      "page": 1,
      "quote": "Funds are from documented salary receipts.",
      "value": "declared receipts"
    },
    {
      "char_span": [
        58,
        89
      ],
      "doc_id": "DOC-700159-006",
      "key": "media_status",
      "page": 1,
      "quote": "Status: regulatory final notice",
      "value": "regulatory final notice"
    }
  ],
  "gaps": [],
  "ownership": {
    "beneficial_owners": [],
    "control_person": null,
    "paths": [],
    "unresolved_pct": 0.0
  },
  "provenance": {
    "generator_seed": 20961181,
    "human_reviewed": false,
    "kind": "SYNTHETIC_ORACLE",
    "release_gate_eligible": false
  },
  "quarantine_doc_ids": [],
  "recommendation": "PROCEED",
  "required_gates": [],
  "required_refusals": [],
  "risk": {
    "band": "LOW",
    "cdd_level": "SDD",
    "factor_inputs": {
      "F-BEH-01": false,
      "F-BEH-02": false,
      "F-BEH-03": false,
      "F-CHAN-01": false,
      "F-CHAN-02": false,
      "F-CUST-01": false,
      "F-CUST-02": true,
      "F-CUST-03": false,
      "F-CUST-04": false,
      "F-CUST-05": false,
      "F-CUST-06": false,
      "F-CUST-07": false,
      "F-CUST-08": false,
      "F-GEO-01": false,
      "F-GEO-02": false,
      "F-GEO-03": false,
      "F-GEO-04": false,
      "F-GEO-05": false,
      "F-PROD-01": false,
      "F-PROD-02": false
    },
    "overrides_applied": [],
    "score": 7.0
  },
  "screening": {
    "expected_query_count": 11,
    "true_pep_subjects": [],
    "true_sanctions_subjects": [],
    "unavailable_lists": [],
    "weak_sanctions_subjects": []
  },
  "search_mock": {
    "namesake_exclusion_urls": [
      "https://localnews.example/synthetic/case-700159/namesake"
    ],
    "paywall_gap_urls": [],
    "quarantine_urls": [],
    "refusal_urls": [],
    "relevant_media_urls": [
      "https://fca.org.uk/synthetic/case-700159/media"
    ],
    "source_urls": [
      "https://citydesk.example/cases/case-700159/profile",
      "https://fca.org.uk/synthetic/case-700159/media",
      "https://localnews.example/synthetic/case-700159/namesake"
    ]
  },
  "segment": "individual_pep_media",
  "tags": [
    "individual_pep_media",
    "media_final_notice"
  ],
  "verified_fields": [
    {
      "char_span": [
        19,
        43
      ],
      "doc_id": "DOC-700159-001",
      "key": "legal_name",
      "page": 1,
      "quote": "Name: Ari Simvale 700159",
      "value": "Ari Simvale 700159"
    },
    {
      "char_span": [
        44,
        69
      ],
      "doc_id": "DOC-700159-001",
      "key": "date_of_birth",
      "page": 1,
      "quote": "Date of birth: 1985-09-14",
      "value": "1985-09-14"
    },
    {
      "char_span": [
        86,
        111
      ],
      "doc_id": "DOC-700159-001",
      "key": "passport_number",
      "page": 1,
      "quote": "Passport number: X700159A",
      "value": "X700159A"
    },
    {
      "char_span": [
        46,
        88
      ],
      "doc_id": "DOC-700159-002",
      "key": "address",
      "page": 1,
      "quote": "Address: 1 Test Street, Sample City 700159",
      "value": "1 Test Street, Sample City 700159"
    },
    {
      "char_span": [
        62,
        90
      ],
      "doc_id": "DOC-700159-003",
      "key": "annual_income_or_revenue",
      "page": 1,
      "quote": "Annual income: USD 1,066,000",
      "value": 1066000
    },
    {
      "char_span": [
        69,
        95
      ],
      "doc_id": "DOC-700159-004",
      "key": "period_credits",
      "page": 1,
      "quote": "Total credits: USD 173,000",
      "value": 173000
    }
  ]
}
