{
  "activity": {
    "annual_income_or_revenue_usd": 406000,
    "annualised_credit_to_income_or_revenue_ratio": 0.8079,
    "annualised_credits_usd": 328000.0,
    "inconsistent": false,
    "period_credits_usd": 82000,
    "period_months": 3
  },
  "case_id": "CASE-700079",
  "coverage": {
    "documents_total": 16,
    "pages_total": 307,
    "pages_unreadable": 0
  },
  "decision_authority": "HUMAN",
  "evidence_anchors": [
    {
      "char_span": [
        29,
        74
      ],
      "doc_id": "DOC-700079-001",
      "key": "legal_name",
      "page": 1,
      "quote": "Company name: Jori Simvale Trading 700079 Ltd",
      "value": "Jori Simvale Trading 700079 Ltd"
    },
    {
      "char_span": [
        75,
        101
      ],
      "doc_id": "DOC-700079-001",
      "key": "incorporation_number",
      "page": 1,
      "quote": "Company number: TST-700079",
      "value": "TST-700079"
    },
    {
      "char_span": [
        62,
        88
      ],
      "doc_id": "DOC-700079-002",
      "key": "registry_number",
      "page": 1,
      "quote": "Company number: TST-700079",
      "value": "TST-700079"
    },
    {
      "char_span": [
        19,
        43
      ],
      "doc_id": "DOC-700079-003",
      "key": "owner_1_name",
      "page": 1,
      "quote": "Name: Ari Mockley 700079",
      "value": "Ari Mockley 700079"
    },
    {
      "char_span": [
        19,
        46
      ],
      "doc_id": "DOC-700079-004",
      "key": "owner_2_name",
      "page": 1,
      "quote": "Name: Bela Trialford 700079",
      "value": "Bela Trialford 700079"
    },
    {
      "char_span": [
        22,
        69
      ],
      "doc_id": "DOC-700079-005",
      "key": "control_person",
      "page": 1,
      "quote": "Director and control person: Ari Mockley 700079",
      "value": "Ari Mockley 700079"
    },
    {
      "char_span": [
        59,
        101
      ],
      "doc_id": "DOC-700079-006",
      "key": "address",
      "page": 1,
      "quote": "Address: 1 Test Street, Sample City 700079",
      "value": "1 Test Street, Sample City 700079"
    },
    {
      "char_span": [
        49,
        82
      ],
      "doc_id": "DOC-700079-007",
      "key": "primary_share",
      "page": 1,
      "quote": "Layer 1 Holdings 700079 Ltd | 70%",
      "value": 70
    },
    {
      "char_span": [
        83,
        120
      ],
      "doc_id": "DOC-700079-007",
      "key": "nominee_share",
      "page": 1,
      "quote": "Undisclosed Nominees 700079 Ltd | 30%",
      "value": 30
    },
    {
      "char_span": [
        76,
        96
      ],
      "doc_id": "DOC-700079-014",
      "key": "annual_income_or_revenue",
      "page": 1,
      "quote": "Revenue: USD 406,000",
      "value": 406000
    },
    {
      "char_span": [
        82,
        107
      ],
      "doc_id": "DOC-700079-015",
      "key": "period_credits",
      "page": 1,
      "quote": "Total credits: USD 82,000",
      "value": 82000
    },
    {
      "char_span": [
        58,
        102
      ],
      "doc_id": "DOC-700079-016",
      "key": "source_of_funds",
      "page": 1,
      "quote": "Funds are from documented business receipts.",
      "value": "declared receipts"
    }
  ],
  "gaps": [
    "LOOKTHROUGH_DEPTH_EXCEEDED",
    "UNRESOLVED_UBO"
  ],
  "ownership": {
    "beneficial_owners": [
      {
        "effective_pct": 59.5,
        "name": "Ari Mockley 700079"
      }
    ],
    "control_person": "Ari Mockley 700079",
    "paths": [
      {
        "basis": "document",
        "effective_pct": 59.5,
        "nodes": [
          "Ari Mockley 700079",
          "Layer 6 Holdings 700079 Ltd",
          "Layer 5 Holdings 700079 Ltd",
          "Layer 4 Holdings 700079 Ltd",
          "Layer 3 Holdings 700079 Ltd",
          "Layer 2 Holdings 700079 Ltd",
          "Layer 1 Holdings 700079 Ltd",
          "Jori Simvale Trading 700079 Ltd"
        ],
        "percentages": [
          85.0,
          100.0,
          100.0,
          100.0,
          100.0,
          100.0,
          70.0
        ],
        "person": "Ari Mockley 700079"
      },
      {
        "basis": "document",
        "effective_pct": 10.5,
        "nodes": [
          "Bela Trialford 700079",
          "Layer 6 Holdings 700079 Ltd",
          "Layer 5 Holdings 700079 Ltd",
          "Layer 4 Holdings 700079 Ltd",
          "Layer 3 Holdings 700079 Ltd",
          "Layer 2 Holdings 700079 Ltd",
          "Layer 1 Holdings 700079 Ltd",
          "Jori Simvale Trading 700079 Ltd"
        ],
        "percentages": [
          15.0,
          100.0,
          100.0,
          100.0,
          100.0,
          100.0,
          70.0
        ],
        "person": "Bela Trialford 700079"
      }
    ],
    "unresolved_pct": 30.0
  },
  "provenance": {
    "generator_seed": 20961101,
    "human_reviewed": false,
    "kind": "SYNTHETIC_ORACLE",
    "release_gate_eligible": false
  },
  "quarantine_doc_ids": [],
  "recommendation": "HOLD_FOR_RFI",
  "required_gates": [
    "G3"
  ],
  "required_refusals": [],
  "risk": {
    "band": "HIGH",
    "cdd_level": "EDD",
    "factor_inputs": {
      "F-BEH-01": false,
      "F-BEH-02": false,
      "F-BEH-03": false,
      "F-CHAN-01": false,
      "F-CHAN-02": false,
      "F-CUST-01": false,
      "F-CUST-02": false,
      "F-CUST-03": false,
      "F-CUST-04": true,
      "F-CUST-05": true,
      "F-CUST-06": false,
      "F-CUST-07": false,
      "F-CUST-08": false,
      "F-GEO-01": false,
      "F-GEO-02": false,
      "F-GEO-03": false,
      "F-GEO-04": false,
      "F-GEO-05": false,
      "F-PROD-01": true,
      "F-PROD-02": false
    },
    "overrides_applied": [
      {
        "factor_id": "F-CUST-04",
        "min_band": "HIGH",
        "reason": "opaque / unresolved ownership"
      }
    ],
    "score": 15.2
  },
  "screening": {
    "expected_query_count": 33,
    "true_pep_subjects": [],
    "true_sanctions_subjects": [],
    "unavailable_lists": [],
    "weak_sanctions_subjects": []
  },
  "search_mock": {
    "namesake_exclusion_urls": [],
    "paywall_gap_urls": [],
    "quarantine_urls": [],
    "refusal_urls": [],
    "relevant_media_urls": [],
    "source_urls": [
      "https://citydesk.example/cases/case-700079/profile"
    ]
  },
  "segment": "corporate_complex",
  "tags": [
    "corporate_complex",
    "lookthrough_depth_exceeded",
    "nominee_unresolved",
    "ownership_depth_7"
  ],
  "verified_fields": [
    {
      "char_span": [
        29,
        74
      ],
      "doc_id": "DOC-700079-001",
      "key": "legal_name",
      "page": 1,
      "quote": "Company name: Jori Simvale Trading 700079 Ltd",
      "value": "Jori Simvale Trading 700079 Ltd"
    },
    {
      "char_span": [
        75,
        101
      ],
      "doc_id": "DOC-700079-001",
      "key": "incorporation_number",
      "page": 1,
      "quote": "Company number: TST-700079",
      "value": "TST-700079"
    },
    {
      "char_span": [
        62,
        88
      ],
      "doc_id": "DOC-700079-002",
      "key": "registry_number",
      "page": 1,
      "quote": "Company number: TST-700079",
      "value": "TST-700079"
    },
    {
      "char_span": [
        19,
        43
      ],
      "doc_id": "DOC-700079-003",
      "key": "owner_1_name",
      "page": 1,
      "quote": "Name: Ari Mockley 700079",
      "value": "Ari Mockley 700079"
    },
    {
      "char_span": [
        19,
        46
      ],
      "doc_id": "DOC-700079-004",
      "key": "owner_2_name",
      "page": 1,
      "quote": "Name: Bela Trialford 700079",
      "value": "Bela Trialford 700079"
    },
    {
      "char_span": [
        22,
        69
      ],
      "doc_id": "DOC-700079-005",
      "key": "control_person",
      "page": 1,
      "quote": "Director and control person: Ari Mockley 700079",
      "value": "Ari Mockley 700079"
    },
    {
      "char_span": [
        59,
        101
      ],
      "doc_id": "DOC-700079-006",
      "key": "address",
      "page": 1,
      "quote": "Address: 1 Test Street, Sample City 700079",
      "value": "1 Test Street, Sample City 700079"
    },
    {
      "char_span": [
        76,
        96
      ],
      "doc_id": "DOC-700079-014",
      "key": "annual_income_or_revenue",
      "page": 1,
      "quote": "Revenue: USD 406,000",
      "value": 406000
    },
    {
      "char_span": [
        82,
        107
      ],
      "doc_id": "DOC-700079-015",
      "key": "period_credits",
      "page": 1,
      "quote": "Total credits: USD 82,000",
      "value": 82000
    }
  ]
}
