{
  "activity": {
    "annual_income_or_revenue_usd": 300000,
    "annualised_credit_to_income_or_revenue_ratio": 2.5067,
    "annualised_credits_usd": 752000.0,
    "inconsistent": true,
    "period_credits_usd": 188000,
    "period_months": 3
  },
  "case_id": "CASE-700171",
  "coverage": {
    "documents_total": 12,
    "pages_total": 70,
    "pages_unreadable": 0
  },
  "decision_authority": "HUMAN",
  "evidence_anchors": [
    {
      "char_span": [
        29,
        76
      ],
      "doc_id": "DOC-700171-001",
      "key": "legal_name",
      "page": 1,
      "quote": "Company name: Bela Sampleton Trading 700171 Ltd",
      "value": "Bela Sampleton Trading 700171 Ltd"
    },
    {
      "char_span": [
        77,
        103
      ],
      "doc_id": "DOC-700171-001",
      "key": "incorporation_number",
      "page": 1,
      "quote": "Company number: TST-700171",
      "value": "TST-700171"
    },
    {
      "char_span": [
        19,
        46
      ],
      "doc_id": "DOC-700171-002",
      "key": "owner_1_name",
      "page": 1,
      "quote": "Name: Cato Trialford 700171",
      "value": "Cato Trialford 700171"
    },
    {
      "char_span": [
        19,
        47
      ],
      "doc_id": "DOC-700171-003",
      "key": "owner_2_name",
      "page": 1,
      "quote": "Name: Dara Exampleton 700171",
      "value": "Dara Exampleton 700171"
    },
    {
      "char_span": [
        22,
        72
      ],
      "doc_id": "DOC-700171-004",
      "key": "control_person",
      "page": 1,
      "quote": "Director and control person: Cato Trialford 700171",
      "value": "Cato Trialford 700171"
    },
    {
      "char_span": [
        61,
        103
      ],
      "doc_id": "DOC-700171-005",
      "key": "address",
      "page": 1,
      "quote": "Address: 1 Test Street, Sample City 700171",
      "value": "1 Test Street, Sample City 700171"
    },
    {
      "char_span": [
        51,
        84
      ],
      "doc_id": "DOC-700171-006",
      "key": "primary_share",
      "page": 1,
      "quote": "Layer 1 Holdings 700171 Ltd | 60%",
      "value": 60
    },
    {
      "char_span": [
        85,
        122
      ],
      "doc_id": "DOC-700171-006",
      "key": "nominee_share",
      "page": 1,
      "quote": "Undisclosed Nominees 700171 Ltd | 40%",
      "value": 40
    },
    {
      "char_span": [
        78,
        98
      ],
      "doc_id": "DOC-700171-009",
      "key": "annual_income_or_revenue",
      "page": 1,
      "quote": "Revenue: USD 300,000",
      "value": 300000
    },
    {
      "char_span": [
        84,
        110
      ],
      "doc_id": "DOC-700171-010",
      "key": "period_credits",
      "page": 1,
      "quote": "Total credits: USD 188,000",
      "value": 188000
    },
    {
      "char_span": [
        60,
        104
      ],
      "doc_id": "DOC-700171-011",
      "key": "source_of_funds",
      "page": 1,
      "quote": "Funds are from documented business receipts.",
      "value": "declared receipts"
    },
    {
      "char_span": [
        61,
        92
      ],
      "doc_id": "DOC-700171-012",
      "key": "media_status",
      "page": 1,
      "quote": "Status: regulatory final notice",
      "value": "regulatory final notice"
    }
  ],
  "gaps": [
    "ACTIVITY_EXPLANATION_REQUIRED",
    "REGISTRY_UNAVAILABLE",
    "UNRESOLVED_UBO"
  ],
  "ownership": {
    "beneficial_owners": [
      {
        "effective_pct": 36.0,
        "name": "Cato Trialford 700171"
      }
    ],
    "control_person": "Cato Trialford 700171",
    "paths": [
      {
        "basis": "document",
        "effective_pct": 36.0,
        "nodes": [
          "Cato Trialford 700171",
          "Layer 2 Holdings 700171 Ltd",
          "Layer 1 Holdings 700171 Ltd",
          "Bela Sampleton Trading 700171 Ltd"
        ],
        "percentages": [
          60.0,
          100.0,
          60.0
        ],
        "person": "Cato Trialford 700171"
      },
      {
        "basis": "document",
        "effective_pct": 24.0,
        "nodes": [
          "Dara Exampleton 700171",
          "Layer 2 Holdings 700171 Ltd",
          "Layer 1 Holdings 700171 Ltd",
          "Bela Sampleton Trading 700171 Ltd"
        ],
        "percentages": [
          40.0,
          100.0,
          60.0
        ],
        "person": "Dara Exampleton 700171"
      }
    ],
    "unresolved_pct": 40.0
  },
  "provenance": {
    "generator_seed": 20961193,
    "human_reviewed": false,
    "kind": "SYNTHETIC_ORACLE",
    "release_gate_eligible": false
  },
  "quarantine_doc_ids": [],
  "recommendation": "REFER_MLRO",
  "required_gates": [
    "G2",
    "G3"
  ],
  "required_refusals": [
    "NO_SELF_CLEAR_SANCTIONS"
  ],
  "risk": {
    "band": "VERY_HIGH",
    "cdd_level": "EDD",
    "factor_inputs": {
      "F-BEH-01": true,
      "F-BEH-02": false,
      "F-BEH-03": false,
      "F-CHAN-01": true,
      "F-CHAN-02": true,
      "F-CUST-01": true,
      "F-CUST-02": true,
      "F-CUST-03": true,
      "F-CUST-04": true,
      "F-CUST-05": false,
      "F-CUST-06": false,
      "F-CUST-07": false,
      "F-CUST-08": false,
      "F-GEO-01": false,
      "F-GEO-02": false,
      "F-GEO-03": true,
      "F-GEO-04": false,
      "F-GEO-05": false,
      "F-PROD-01": true,
      "F-PROD-02": false
    },
    "overrides_applied": [
      {
        "factor_id": "F-CUST-03",
        "min_band": "VERY_HIGH",
        "reason": "sanctions proximity"
      },
      {
        "factor_id": "F-CUST-01",
        "min_band": "HIGH",
        "reason": "PEP exposure"
      },
      {
        "factor_id": "F-CUST-04",
        "min_band": "HIGH",
        "reason": "opaque / unresolved ownership"
      },
      {
        "factor_id": "F-BEH-01",
        "min_band": "HIGH",
        "reason": "activity inconsistent with declared profile"
      }
    ],
    "score": 47.55
  },
  "screening": {
    "expected_query_count": 33,
    "true_pep_subjects": [
      "Cato Trialford 700171"
    ],
    "true_sanctions_subjects": [
      "Cato Trialford 700171"
    ],
    "unavailable_lists": [],
    "weak_sanctions_subjects": []
  },
  "search_mock": {
    "namesake_exclusion_urls": [
      "https://localnews.example/synthetic/case-700171/namesake"
    ],
    "paywall_gap_urls": [],
    "quarantine_urls": [],
    "refusal_urls": [],
    "relevant_media_urls": [
      "https://fca.org.uk/synthetic/case-700171/media"
    ],
    "source_urls": [
      "https://citydesk.example/cases/case-700171/profile",
      "https://fca.org.uk/synthetic/case-700171/media",
      "https://localnews.example/synthetic/case-700171/namesake"
    ]
  },
  "segment": "high_risk_jurisdiction",
  "tags": [
    "activity_inconsistent",
    "high_risk_jurisdiction",
    "media_final_notice",
    "nominee_unresolved",
    "ownership_depth_3",
    "pep_true_hit",
    "registry_unavailable",
    "sanctions_true_hit"
  ],
  "verified_fields": [
    {
      "char_span": [
        29,
        76
      ],
      "doc_id": "DOC-700171-001",
      "key": "legal_name",
      "page": 1,
      "quote": "Company name: Bela Sampleton Trading 700171 Ltd",
      "value": "Bela Sampleton Trading 700171 Ltd"
    },
    {
      "char_span": [
        77,
        103
      ],
      "doc_id": "DOC-700171-001",
      "key": "incorporation_number",
      "page": 1,
      "quote": "Company number: TST-700171",
      "value": "TST-700171"
    },
    {
      "char_span": [
        19,
        46
      ],
      "doc_id": "DOC-700171-002",
      "key": "owner_1_name",
      "page": 1,
      "quote": "Name: Cato Trialford 700171",
      "value": "Cato Trialford 700171"
    },
    {
      "char_span": [
        19,
        47
      ],
      "doc_id": "DOC-700171-003",
      "key": "owner_2_name",
      "page": 1,
      "quote": "Name: Dara Exampleton 700171",
      "value": "Dara Exampleton 700171"
    },
    {
      "char_span": [
        22,
        72
      ],
      "doc_id": "DOC-700171-004",
      "key": "control_person",
      "page": 1,
      "quote": "Director and control person: Cato Trialford 700171",
      "value": "Cato Trialford 700171"
    },
    {
      "char_span": [
        61,
        103
      ],
      "doc_id": "DOC-700171-005",
      "key": "address",
      "page": 1,
      "quote": "Address: 1 Test Street, Sample City 700171",
      "value": "1 Test Street, Sample City 700171"
    },
    {
      "char_span": [
        78,
        98
      ],
      "doc_id": "DOC-700171-009",
      "key": "annual_income_or_revenue",
      "page": 1,
      "quote": "Revenue: USD 300,000",
      "value": 300000
    },
    {
      "char_span": [
        84,
        110
      ],
      "doc_id": "DOC-700171-010",
      "key": "period_credits",
      "page": 1,
      "quote": "Total credits: USD 188,000",
      "value": 188000
    }
  ]
}
