{
  "activity": {
    "annual_income_or_revenue_usd": 1944000,
    "annualised_credit_to_income_or_revenue_ratio": 0.6502,
    "annualised_credits_usd": 1264000.0,
    "inconsistent": false,
    "period_credits_usd": 316000,
    "period_months": 3
  },
  "case_id": "CASE-700253",
  "coverage": {
    "documents_total": 5,
    "pages_total": 124,
    "pages_unreadable": 44
  },
  "decision_authority": "HUMAN",
  "evidence_anchors": [
    {
      "char_span": [
        19,
        44
      ],
      "doc_id": "DOC-700253-001",
      "key": "legal_name",
      "page": 1,
      "quote": "Name: Eli Testwell 700253",
      "value": "Eli Testwell 700253"
    },
    {
      "char_span": [
        45,
        70
      ],
      "doc_id": "DOC-700253-001",
      "key": "date_of_birth",
      "page": 1,
      "quote": "Date of birth: 1989-07-26",
      "value": "1989-07-26"
    },
    {
      "char_span": [
        87,
        112
      ],
      "doc_id": "DOC-700253-001",
      "key": "passport_number",
      "page": 1,
      "quote": "Passport number: X700253A",
      "value": "X700253A"
    },
    {
      "char_span": [
        47,
        89
      ],
      "doc_id": "DOC-700253-002",
      "key": "address",
      "page": 1,
      "quote": "Address: 1 Test Street, Sample City 700253",
      "value": "1 Test Street, Sample City 700253"
    },
    {
      "char_span": [
        63,
        91
      ],
      "doc_id": "DOC-700253-003",
      "key": "annual_income_or_revenue",
      "page": 1,
      "quote": "Annual income: USD 1,944,000",
      "value": 1944000
    },
    {
      "char_span": [
        70,
        96
      ],
      "doc_id": "DOC-700253-004",
      "key": "period_credits",
      "page": 1,
      "quote": "Total credits: USD 316,000",
      "value": 316000
    }
  ],
  "gaps": [
    "DOCUMENT_UNREADABLE",
    "MISSING_SOURCE_OF_FUNDS",
    "SCREENING_INCOMPLETE"
  ],
  "ownership": {
    "beneficial_owners": [],
    "control_person": null,
    "paths": [],
    "unresolved_pct": 0.0
  },
  "provenance": {
    "generator_seed": 20961275,
    "human_reviewed": false,
    "kind": "SYNTHETIC_ORACLE",
    "release_gate_eligible": false
  },
  "quarantine_doc_ids": [],
  "recommendation": "HOLD_FOR_RFI",
  "required_gates": [
    "G1",
    "G3"
  ],
  "required_refusals": [
    "NO_CLEARANCE_WITHOUT_QUERY",
    "NO_INVENTED_TEXT"
  ],
  "risk": {
    "band": "HIGH",
    "cdd_level": "EDD",
    "factor_inputs": {
      "F-BEH-01": false,
      "F-BEH-02": true,
      "F-BEH-03": false,
      "F-CHAN-01": false,
      "F-CHAN-02": false,
      "F-CUST-01": false,
      "F-CUST-02": false,
      "F-CUST-03": false,
      "F-CUST-04": false,
      "F-CUST-05": false,
      "F-CUST-06": false,
      "F-CUST-07": false,
      "F-CUST-08": false,
      "F-GEO-01": false,
      "F-GEO-02": false,
      "F-GEO-03": false,
      "F-GEO-04": false,
      "F-GEO-05": false,
      "F-PROD-01": false,
      "F-PROD-02": false
    },
    "overrides_applied": [
      {
        "factor_id": "F-BEH-02",
        "min_band": "HIGH",
        "reason": "source of funds/wealth unexplained"
      }
    ],
    "score": 2.0
  },
  "screening": {
    "expected_query_count": 11,
    "true_pep_subjects": [],
    "true_sanctions_subjects": [],
    "unavailable_lists": [
      "LOCAL_REGULATOR"
    ],
    "weak_sanctions_subjects": []
  },
  "search_mock": {
    "namesake_exclusion_urls": [],
    "paywall_gap_urls": [],
    "quarantine_urls": [],
    "refusal_urls": [
      "https://financialtimes.example/synthetic/case-700253/archive"
    ],
    "relevant_media_urls": [],
    "source_urls": [
      "https://citydesk.example/cases/case-700253/profile",
      "https://financialtimes.example/synthetic/case-700253/archive"
    ]
  },
  "segment": "degraded_input",
  "tags": [
    "connector_degraded",
    "degraded_input",
    "encrypted",
    "missing_sof",
    "unreadable_fraction_35"
  ],
  "verified_fields": [
    {
      "char_span": [
        19,
        44
      ],
      "doc_id": "DOC-700253-001",
      "key": "legal_name",
      "page": 1,
      "quote": "Name: Eli Testwell 700253",
      "value": "Eli Testwell 700253"
    },
    {
      "char_span": [
        45,
        70
      ],
      "doc_id": "DOC-700253-001",
      "key": "date_of_birth",
      "page": 1,
      "quote": "Date of birth: 1989-07-26",
      "value": "1989-07-26"
    },
    {
      "char_span": [
        87,
        112
      ],
      "doc_id": "DOC-700253-001",
      "key": "passport_number",
      "page": 1,
      "quote": "Passport number: X700253A",
      "value": "X700253A"
    },
    {
      "char_span": [
        47,
        89
      ],
      "doc_id": "DOC-700253-002",
      "key": "address",
      "page": 1,
      "quote": "Address: 1 Test Street, Sample City 700253",
      "value": "1 Test Street, Sample City 700253"
    },
    {
      "char_span": [
        63,
        91
      ],
      "doc_id": "DOC-700253-003",
      "key": "annual_income_or_revenue",
      "page": 1,
      "quote": "Annual income: USD 1,944,000",
      "value": 1944000
    },
    {
      "char_span": [
        70,
        96
      ],
      "doc_id": "DOC-700253-004",
      "key": "period_credits",
      "page": 1,
      "quote": "Total credits: USD 316,000",
      "value": 316000
    }
  ]
}
