{
  "activity": {
    "annual_income_or_revenue_usd": 599000,
    "annualised_credit_to_income_or_revenue_ratio": 0.6477,
    "annualised_credits_usd": 388000.0,
    "inconsistent": false,
    "period_credits_usd": 97000,
    "period_months": 3
  },
  "case_id": "CASE-700068",
  "coverage": {
    "documents_total": 18,
    "pages_total": 151,
    "pages_unreadable": 0
  },
  "decision_authority": "HUMAN",
  "evidence_anchors": [
    {
      "char_span": [
        29,
        74
      ],
      "doc_id": "DOC-700068-001",
      "key": "legal_name",
      "page": 1,
      "quote": "Company name: Iva Testwell Trading 700068 Ltd",
      "value": "Iva Testwell Trading 700068 Ltd"
    },
    {
      "char_span": [
        75,
        101
      ],
      "doc_id": "DOC-700068-001",
      "key": "incorporation_number",
      "page": 1,
      "quote": "Company number: TST-700068",
      "value": "TST-700068"
    },
    {
      "char_span": [
        62,
        88
      ],
      "doc_id": "DOC-700068-002",
      "key": "registry_number",
      "page": 1,
      "quote": "Company number: TST-700068",
      "value": "TST-700068"
    },
    {
      "char_span": [
        19,
        44
      ],
      "doc_id": "DOC-700068-003",
      "key": "owner_1_name",
      "page": 1,
      "quote": "Name: Jori Simvale 700068",
      "value": "Jori Simvale 700068"
    },
    {
      "char_span": [
        19,
        44
      ],
      "doc_id": "DOC-700068-004",
      "key": "owner_2_name",
      "page": 1,
      "quote": "Name: Ari Testwell 700068",
      "value": "Ari Testwell 700068"
    },
    {
      "char_span": [
        22,
        70
      ],
      "doc_id": "DOC-700068-005",
      "key": "control_person",
      "page": 1,
      "quote": "Director and control person: Jori Simvale 700068",
      "value": "Jori Simvale 700068"
    },
    {
      "char_span": [
        59,
        101
      ],
      "doc_id": "DOC-700068-006",
      "key": "address",
      "page": 1,
      "quote": "Address: 1 Test Street, Sample City 700068",
      "value": "1 Test Street, Sample City 700068"
    },
    {
      "char_span": [
        49,
        82
      ],
      "doc_id": "DOC-700068-007",
      "key": "primary_share",
      "page": 1,
      "quote": "Layer 1 Holdings 700068 Ltd | 45%",
      "value": 45
    },
    {
      "char_span": [
        83,
        120
      ],
      "doc_id": "DOC-700068-007",
      "key": "nominee_share",
      "page": 1,
      "quote": "Undisclosed Nominees 700068 Ltd | 45%",
      "value": 45
    },
    {
      "char_span": [
        40,
        79
      ],
      "doc_id": "DOC-700068-008",
      "key": "vested_beneficiary",
      "page": 1,
      "quote": "Vested beneficiary: Jori Simvale 700068",
      "value": "Jori Simvale 700068"
    },
    {
      "char_span": [
        76,
        96
      ],
      "doc_id": "DOC-700068-016",
      "key": "annual_income_or_revenue",
      "page": 1,
      "quote": "Revenue: USD 599,000",
      "value": 599000
    },
    {
      "char_span": [
        82,
        107
      ],
      "doc_id": "DOC-700068-017",
      "key": "period_credits",
      "page": 1,
      "quote": "Total credits: USD 97,000",
      "value": 97000
    },
    {
      "char_span": [
        58,
        102
      ],
      "doc_id": "DOC-700068-018",
      "key": "source_of_funds",
      "page": 1,
      "quote": "Funds are from documented business receipts.",
      "value": "declared receipts"
    }
  ],
  "gaps": [
    "LOOKTHROUGH_DEPTH_EXCEEDED",
    "UNRESOLVED_UBO"
  ],
  "ownership": {
    "beneficial_owners": [
      {
        "effective_pct": 37.0,
        "name": "Jori Simvale 700068"
      }
    ],
    "control_person": "Jori Simvale 700068",
    "paths": [
      {
        "basis": "document",
        "effective_pct": 10.0,
        "nodes": [
          "Jori Simvale 700068",
          "Elm Test Trust 700068",
          "Iva Testwell Trading 700068 Ltd"
        ],
        "percentages": [
          100.0,
          10.0
        ],
        "person": "Jori Simvale 700068"
      },
      {
        "basis": "document",
        "effective_pct": 27.0,
        "nodes": [
          "Jori Simvale 700068",
          "Layer 7 Holdings 700068 Ltd",
          "Layer 6 Holdings 700068 Ltd",
          "Layer 5 Holdings 700068 Ltd",
          "Layer 4 Holdings 700068 Ltd",
          "Layer 3 Holdings 700068 Ltd",
          "Layer 2 Holdings 700068 Ltd",
          "Layer 1 Holdings 700068 Ltd",
          "Iva Testwell Trading 700068 Ltd"
        ],
        "percentages": [
          60.0,
          100.0,
          100.0,
          100.0,
          100.0,
          100.0,
          100.0,
          45.0
        ],
        "person": "Jori Simvale 700068"
      },
      {
        "basis": "document",
        "effective_pct": 18.0,
        "nodes": [
          "Ari Testwell 700068",
          "Layer 7 Holdings 700068 Ltd",
          "Layer 6 Holdings 700068 Ltd",
          "Layer 5 Holdings 700068 Ltd",
          "Layer 4 Holdings 700068 Ltd",
          "Layer 3 Holdings 700068 Ltd",
          "Layer 2 Holdings 700068 Ltd",
          "Layer 1 Holdings 700068 Ltd",
          "Iva Testwell Trading 700068 Ltd"
        ],
        "percentages": [
          40.0,
          100.0,
          100.0,
          100.0,
          100.0,
          100.0,
          100.0,
          45.0
        ],
        "person": "Ari Testwell 700068"
      }
    ],
    "unresolved_pct": 45.0
  },
  "provenance": {
    "generator_seed": 20961090,
    "human_reviewed": false,
    "kind": "SYNTHETIC_ORACLE",
    "release_gate_eligible": false
  },
  "quarantine_doc_ids": [],
  "recommendation": "HOLD_FOR_RFI",
  "required_gates": [
    "G3"
  ],
  "required_refusals": [],
  "risk": {
    "band": "HIGH",
    "cdd_level": "EDD",
    "factor_inputs": {
      "F-BEH-01": false,
      "F-BEH-02": false,
      "F-BEH-03": false,
      "F-CHAN-01": false,
      "F-CHAN-02": false,
      "F-CUST-01": false,
      "F-CUST-02": false,
      "F-CUST-03": false,
      "F-CUST-04": true,
      "F-CUST-05": true,
      "F-CUST-06": false,
      "F-CUST-07": false,
      "F-CUST-08": false,
      "F-GEO-01": false,
      "F-GEO-02": false,
      "F-GEO-03": false,
      "F-GEO-04": false,
      "F-GEO-05": false,
      "F-PROD-01": false,
      "F-PROD-02": false
    },
    "overrides_applied": [
      {
        "factor_id": "F-CUST-04",
        "min_band": "HIGH",
        "reason": "opaque / unresolved ownership"
      }
    ],
    "score": 11.2
  },
  "screening": {
    "expected_query_count": 33,
    "true_pep_subjects": [],
    "true_sanctions_subjects": [],
    "unavailable_lists": [],
    "weak_sanctions_subjects": []
  },
  "search_mock": {
    "namesake_exclusion_urls": [],
    "paywall_gap_urls": [],
    "quarantine_urls": [],
    "refusal_urls": [],
    "relevant_media_urls": [],
    "source_urls": [
      "https://citydesk.example/cases/case-700068/profile"
    ]
  },
  "segment": "corporate_complex",
  "tags": [
    "corporate_complex",
    "lookthrough_depth_exceeded",
    "nominee_unresolved",
    "ownership_depth_8",
    "vested_trust"
  ],
  "verified_fields": [
    {
      "char_span": [
        29,
        74
      ],
      "doc_id": "DOC-700068-001",
      "key": "legal_name",
      "page": 1,
      "quote": "Company name: Iva Testwell Trading 700068 Ltd",
      "value": "Iva Testwell Trading 700068 Ltd"
    },
    {
      "char_span": [
        75,
        101
      ],
      "doc_id": "DOC-700068-001",
      "key": "incorporation_number",
      "page": 1,
      "quote": "Company number: TST-700068",
      "value": "TST-700068"
    },
    {
      "char_span": [
        62,
        88
      ],
      "doc_id": "DOC-700068-002",
      "key": "registry_number",
      "page": 1,
      "quote": "Company number: TST-700068",
      "value": "TST-700068"
    },
    {
      "char_span": [
        19,
        44
      ],
      "doc_id": "DOC-700068-003",
      "key": "owner_1_name",
      "page": 1,
      "quote": "Name: Jori Simvale 700068",
      "value": "Jori Simvale 700068"
    },
    {
      "char_span": [
        19,
        44
      ],
      "doc_id": "DOC-700068-004",
      "key": "owner_2_name",
      "page": 1,
      "quote": "Name: Ari Testwell 700068",
      "value": "Ari Testwell 700068"
    },
    {
      "char_span": [
        22,
        70
      ],
      "doc_id": "DOC-700068-005",
      "key": "control_person",
      "page": 1,
      "quote": "Director and control person: Jori Simvale 700068",
      "value": "Jori Simvale 700068"
    },
    {
      "char_span": [
        59,
        101
      ],
      "doc_id": "DOC-700068-006",
      "key": "address",
      "page": 1,
      "quote": "Address: 1 Test Street, Sample City 700068",
      "value": "1 Test Street, Sample City 700068"
    },
    {
      "char_span": [
        76,
        96
      ],
      "doc_id": "DOC-700068-016",
      "key": "annual_income_or_revenue",
      "page": 1,
      "quote": "Revenue: USD 599,000",
      "value": 599000
    },
    {
      "char_span": [
        82,
        107
      ],
      "doc_id": "DOC-700068-017",
      "key": "period_credits",
      "page": 1,
      "quote": "Total credits: USD 97,000",
      "value": 97000
    }
  ]
}
